{
  "schemaVersion": 1,
  "id": "poo-flow-subflows",
  "route": "/poo-flow-subflows",
  "theme": "documents",
  "variant": "mocha",
  "fixture": "benchmarks/fixtures/docs/poo-flow-subflows.org",
  "projects": ["compact-phone", "modern-phone", "tablet", "desktop"],
  "actions": [
    { "type": "goto" },
    {
      "type": "click",
      "target": "[data-poo-flow-scenario='subagent-workflow'] button[aria-label^='Collapse']"
    },
    { "type": "screenshot", "value": "poo-flow-subflows" }
  ],
  "gates": {
    "maxHorizontalOverflowPx": 0,
    "maxConsoleErrors": 0,
    "maxPageErrors": 0,
    "minTapTargetPx": 44
  }
}
