{
  "schemaVersion": 1,
  "id": "gallery-heavy",
  "route": "/gallery",
  "theme": "elegant-blog",
  "variant": "default",
  "fixture": "gallery-heavy",
  "projects": ["compact-phone", "modern-phone", "tablet", "desktop"],
  "actions": [
    { "type": "goto" },
    { "type": "scroll", "value": 1200 },
    { "type": "screenshot", "target": "gallery" }
  ],
  "gates": {
    "maxHorizontalOverflowPx": 0,
    "maxConsoleErrors": 0,
    "maxPageErrors": 0,
    "minTapTargetPx": 44
  }
}
